{
  "evidence": "A commenter called it 'a great guide' and the thread turned into a detailed back-and-forth on GPUs, quantization, and local throughput.",
  "hn_url": "https://news.ycombinator.com/item?id=48775921",
  "id": "2026-07-03:jamesob-s-guide-to-running-sota-llms-locally:48775921",
  "is_repeat": false,
  "issue_id": "2026-07-03",
  "item_id": "jamesob-s-guide-to-running-sota-llms-locally",
  "rank": 1,
  "seen_at": "2026-07-03T21:00:19.436601+00:00",
  "source_story_id": "48775921",
  "source_story_title": "Jamesob's guide to running SOTA LLMs locally"
}
