{
  "evidence": "Discussion compared Muse Spark 1.1 with Grok 4.5 and highlighted the cached-input price/performance tradeoff.",
  "hn_url": "https://news.ycombinator.com/item?id=48846184",
  "id": "2026-07-09:muse-spark-1-1:48846184",
  "is_repeat": false,
  "issue_id": "2026-07-09",
  "item_id": "muse-spark-1-1",
  "rank": 3,
  "seen_at": "2026-07-09T21:13:39.342792Z",
  "source_story_id": "48846184",
  "source_story_title": "Muse Spark 1.1"
}
