{
  "evidence": "Comments compared it with Jira, GitHub Issues, Linear, and worktrees, and liked the customization and WASM plugin plan.",
  "hn_url": "https://news.ycombinator.com/item?id=48515385",
  "id": "2026-06-13:paca:48515385",
  "is_repeat": false,
  "issue_id": "2026-06-13",
  "item_id": "paca",
  "rank": 2,
  "seen_at": "2026-06-13T21:10:41.216149Z",
  "source_story_id": "48515385",
  "source_story_title": "Show HN: Paca \u2013 Lightweight Jira alternative for human-AI collaboration"
}
