{
  "evidence": "HN commenters called Late.sh \u201camazing\u201d and \u201cfantastic,\u201d highlighting its Icecast, IRC, 2048, and LLM features.",
  "hn_url": "https://news.ycombinator.com/item?id=49001127",
  "id": "2026-07-22:late-sh:49001127",
  "is_repeat": false,
  "issue_id": "2026-07-22",
  "item_id": "late-sh",
  "rank": 10,
  "seen_at": "2026-07-22T04:06:53Z",
  "source_story_id": "49001127",
  "source_story_title": "Late.sh \u2013 a command-line Clubhouse for computer people"
}
