{
  "evidence": "A commenter calls Sklar's channel great and describes its studio stories and recorded-song play-alongs.",
  "evidence_sources": [
    {
      "author": "tasty_freeze",
      "comment_id": "50197723",
      "comment_url": "https://news.ycombinator.com/item?id=50197723",
      "excerpt": "Famous studio and touring bassist Lee Sklar has a great youtube channel [1] where he tells war stories and plays along to a few of the thousands of songs he has recorded on over the past 50 years.",
      "kind": "recommendation",
      "parent_comment_id": null
    }
  ],
  "hn_url": "https://news.ycombinator.com/item?id=50150163",
  "id": "2026-10-23:leland-sklar-s-youtube-channel:50150163",
  "is_repeat": false,
  "issue_id": "2026-10-23",
  "item_id": "leland-sklar-s-youtube-channel",
  "rank": 9,
  "seen_at": "2026-10-23T03:19:38+00:00",
  "source_story_id": "50150163",
  "source_story_title": "What Is Gridifcation"
}
