{
  "evidence": "The same comment said, \u201cCheck out ifdb.org for more.\u201d",
  "hn_url": "https://news.ycombinator.com/item?id=48198615",
  "id": "2026-05-23:ifdb:48198615",
  "is_repeat": false,
  "issue_id": "2026-05-23",
  "item_id": "ifdb",
  "rank": 14,
  "seen_at": "2026-05-23T21:13:54Z",
  "source_story_id": "48198615",
  "source_story_title": "Solving the \u201cZork\u201d Mystery"
}
