{
  "evidence": "One comment said Gadgetbridge can often be used instead of the official app.",
  "hn_url": "https://news.ycombinator.com/item?id=48247876",
  "id": "2026-05-23:gadgetbridge:48247876",
  "is_repeat": false,
  "issue_id": "2026-05-23",
  "item_id": "gadgetbridge",
  "rank": 8,
  "seen_at": "2026-05-23T21:13:54Z",
  "source_story_id": "48247876",
  "source_story_title": "Oura says it gets government demands for user data"
}
