{
  "evidence": "Comments framed the acquisition as a likely registry win and debated Apple\u2019s developer-tooling track record.",
  "hn_url": "https://news.ycombinator.com/item?id=48648779",
  "id": "2026-06-23:swift-package-index:48648779",
  "is_repeat": false,
  "issue_id": "2026-06-23",
  "item_id": "swift-package-index",
  "rank": 5,
  "seen_at": "2026-06-23T21:10:00Z",
  "source_story_id": "48648779",
  "source_story_title": "Swift Package Index joins Apple"
}
