{
  "evidence": "A commenter said Micsig makes a good starter probe that would be enough for mains testing.",
  "hn_url": "https://news.ycombinator.com/item?id=48110858",
  "id": "2026-05-12:micsig-mdp-probes:48110858",
  "is_repeat": false,
  "issue_id": "2026-05-12",
  "item_id": "micsig-mdp-probes",
  "rank": 9,
  "seen_at": "2026-05-12T21:14:38Z",
  "source_story_id": "48110858",
  "source_story_title": "Testing UPS Output Waveforms"
}
