{
  "evidence": "Comments highlighted Vue 3 + TipTap, zero telemetry, custom blocks, and keeping sending with the user's own provider.",
  "hn_url": "https://news.ycombinator.com/item?id=48038019",
  "id": "2026-05-06:templatical:48038019",
  "is_repeat": false,
  "issue_id": "2026-05-06",
  "item_id": "templatical",
  "rank": 3,
  "seen_at": "2026-05-06T21:05:20Z",
  "source_story_id": "48038019",
  "source_story_title": "Show HN: I built an open-source email builder, alternative to Beefree/Unlayer"
}
