{
  "evidence": "The maker explained the 500k-inscription extraction pipeline and commenters engaged with the linked source databases and quality metrics.",
  "hn_url": "https://news.ycombinator.com/item?id=48481400",
  "id": "2026-06-13:roman-empire-map:48481400",
  "is_repeat": false,
  "issue_id": "2026-06-13",
  "item_id": "roman-empire-map",
  "rank": 8,
  "seen_at": "2026-06-13T21:10:41.216149Z",
  "source_story_id": "48481400",
  "source_story_title": "Show HN: I am building a map of people who lived in the Roman Empire"
}
