{
  "evidence": "A commenter said vanilla DOSBox was least interesting and listed DOSBox-X among the main maintained forks.",
  "hn_url": "https://news.ycombinator.com/item?id=48356603",
  "id": "2026-06-01:dosbox-x:48356603",
  "is_repeat": false,
  "issue_id": "2026-06-01",
  "item_id": "dosbox-x",
  "rank": 5,
  "seen_at": "2026-06-01T21:20:14Z",
  "source_story_id": "48356603",
  "source_story_title": "Windows GOG DOS Games on M-Series Macs"
}
